file_path,transcription
C:\Users\Angelica\Documents\GitHub\Pamagsalin_Model_Training\data\Audio_Files\(027) Stephanie\cat10_entry020_spk027.m4a,Atyu ya mu keng wanan.
C:\Users\Angelica\Documents\GitHub\Pamagsalin_Model_Training\data\Audio_Files\(027) Stephanie\cat11_entry001_spk027.m4a,Malyari meng pakidwag kanaku ing charger keng lamesa? Kaylangan keng i-charge ing selpon ku ngeni.
C:\Users\Angelica\Documents\GitHub\Pamagsalin_Model_Training\data\Audio_Files\(027) Stephanie\cat11_entry002_spk027.m4a,"O sige, oini na. Pakisabi mu namu kaku nung atin ka pang kailangan."
C:\Users\Angelica\Documents\GitHub\Pamagsalin_Model_Training\data\Audio_Files\(027) Stephanie\cat11_entry003_spk027.m4a,"E me kakalingwang isara ing pasbul kalako mu, lalu na nung alang tau keng bale."
C:\Users\Angelica\Documents\GitHub\Pamagsalin_Model_Training\data\Audio_Files\(027) Stephanie\cat11_entry004_spk027.m4a,"Uwa, siguraduan kung maka sara ya, salamat keng paganaka"
C:\Users\Angelica\Documents\GitHub\Pamagsalin_Model_Training\data\Audio_Files\(027) Stephanie\cat11_entry005_spk027.m4a,Malyari mukung sopan ipanik deng bag areni? Milalu la kasi mabayat para kanaku.
C:\Users\Angelica\Documents\GitHub\Pamagsalin_Model_Training\data\Audio_Files\(027) Stephanie\cat11_entry006_spk027.m4a,Alang problema. Ibwat ko deng aliwa ban mas maligwa keka.
C:\Users\Angelica\Documents\GitHub\Pamagsalin_Model_Training\data\Audio_Files\(027) Stephanie\cat11_entry007_spk027.m4a,Malyari meng i-email ing report kanaku bayu miras alas singku? Bantang a-review ke pa bayu ing pulung.
C:\Users\Angelica\Documents\GitHub\Pamagsalin_Model_Training\data\Audio_Files\(027) Stephanie\cat11_entry008_spk027.m4a,"Awa sige, ibie ke keka bayu ita. Sana makasaup ya keka king pulung."
C:\Users\Angelica\Documents\GitHub\Pamagsalin_Model_Training\data\Audio_Files\(027) Stephanie\cat11_entry009_spk027.m4a,"Panayan muku keng arap, kwanan kemu ing jacket ku kayi lumwal nku."
C:\Users\Angelica\Documents\GitHub\Pamagsalin_Model_Training\data\Audio_Files\(027) Stephanie\cat11_entry010_spk027.m4a,"E ka mamaligwa, panenayan daka keni"
C:\Users\Angelica\Documents\GitHub\Pamagsalin_Model_Training\data\Audio_Files\(027) Stephanie\cat11_entry011_spk027.m4a,Malyari meng palino pasibayu ing sinabi mu? Ali ke kasi ikwa nung nanung buri mung sabyan.
C:\Users\Angelica\Documents\GitHub\Pamagsalin_Model_Training\data\Audio_Files\(027) Stephanie\cat11_entry012_spk027.m4a,O sige. Sabyan keng mas malino keka ngeni
C:\Users\Angelica\Documents\GitHub\Pamagsalin_Model_Training\data\Audio_Files\(027) Stephanie\cat11_entry013_spk027.m4a,Tuknang kapa mag-scroll tsaka ka makiramdam. Atin kung sabyang maulaga.
C:\Users\Angelica\Documents\GitHub\Pamagsalin_Model_Training\data\Audio_Files\(027) Stephanie\cat11_entry014_spk027.m4a,"Ay, panupaya.  Makiramdam naku, nanu ya ing sabyan mu?"
C:\Users\Angelica\Documents\GitHub\Pamagsalin_Model_Training\data\Audio_Files\(027) Stephanie\cat11_entry015_spk027.m4a,"Malyaring bagalan me ing pamagasalita mu ban antindyan daka, ali ke mumunang lengguwahe ing Inglis."
C:\Users\Angelica\Documents\GitHub\Pamagsalin_Model_Training\data\Audio_Files\(027) Stephanie\cat11_entry016_spk027.m4a,"Ah, uwa.. Bagalan kuna. Pasensya naka ne."
C:\Users\Angelica\Documents\GitHub\Pamagsalin_Model_Training\data\Audio_Files\(027) Stephanie\cat11_entry017_spk027.m4a,"Paganaka mu kanaku a tugtugan ko deng tanaman bukas abak, pota langi no naman."
C:\Users\Angelica\Documents\GitHub\Pamagsalin_Model_Training\data\Audio_Files\(027) Stephanie\cat11_entry018_spk027.m4a,Alang problema. Mumunang sabyan ku keka ita kinabukasan
C:\Users\Angelica\Documents\GitHub\Pamagsalin_Model_Training\data\Audio_Files\(027) Stephanie\cat11_entry019_spk027.m4a,"Sabyan mu ing tutu kanaku, mas buri kung damdaman direkta ing tutu."
C:\Users\Angelica\Documents\GitHub\Pamagsalin_Model_Training\data\Audio_Files\(027) Stephanie\cat11_entry020_spk027.m4a,"Respetwan ku ita, ala kung sasalikut keka."
C:\Users\Angelica\Documents\GitHub\Pamagsalin_Model_Training\data\Audio_Files\(027) Stephanie\cat12_entry001_spk027.m4a,Pasalamat ku king dakal a suportang tinggap ku kabang daralan kung masakit a panaun.
C:\Users\Angelica\Documents\GitHub\Pamagsalin_Model_Training\data\Audio_Files\(027) Stephanie\cat12_entry002_spk027.m4a,"Inarap meng masalese, akakit ke."
C:\Users\Angelica\Documents\GitHub\Pamagsalin_Model_Training\data\Audio_Files\(027) Stephanie\cat12_entry003_spk027.m4a,"Ing pelikulang ayta, e ke asahan, ginaga ku pin."
C:\Users\Angelica\Documents\GitHub\Pamagsalin_Model_Training\data\Audio_Files\(027) Stephanie\cat12_entry004_spk027.m4a,"Yaku man, lakwas yang malungkut pala ita keng asahan ku."
C:\Users\Angelica\Documents\GitHub\Pamagsalin_Model_Training\data\Audio_Files\(027) Stephanie\cat12_entry005_spk027.m4a,Mabubusit ku ustung deng aliwang tau e la makiramdam bayu la salangsang.
C:\Users\Angelica\Documents\GitHub\Pamagsalin_Model_Training\data\Audio_Files\(027) Stephanie\cat12_entry006_spk027.m4a,"Ayntindyan daka, dakal bisang magsalita pero ditak la mu ding bisang makiramdam."
C:\Users\Angelica\Documents\GitHub\Pamagsalin_Model_Training\data\Audio_Files\(027) Stephanie\cat12_entry007_spk027.m4a,Neng ka sigasig keng pamanyaup keng kapaligiran.
C:\Users\Angelica\Documents\GitHub\Pamagsalin_Model_Training\data\Audio_Files\(027) Stephanie\cat12_entry008_spk027.m4a,Tatalangan ke ing dedikasyun na.
C:\Users\Angelica\Documents\GitHub\Pamagsalin_Model_Training\data\Audio_Files\(027) Stephanie\cat12_entry009_spk027.m4a,"Kakarug ku bayu ing interbyu, oneng masalese neman"
C:\Users\Angelica\Documents\GitHub\Pamagsalin_Model_Training\data\Audio_Files\(027) Stephanie\cat12_entry010_spk027.m4a,Ikit mo? Mas preparadu ka kesa keng inisip mu.
C:\Users\Angelica\Documents\GitHub\Pamagsalin_Model_Training\data\Audio_Files\(027) Stephanie\cat12_entry011_spk027.m4a,Mababalisa ku tagana kareng mataung lugal.
C:\Users\Angelica\Documents\GitHub\Pamagsalin_Model_Training\data\Audio_Files\(027) Stephanie\cat12_entry012_spk027.m4a,"Nung makanyan, magdatun tamu keng lugar a taimik, nung makasaup ita."
C:\Users\Angelica\Documents\GitHub\Pamagsalin_Model_Training\data\Audio_Files\(027) Stephanie\cat12_entry013_spk027.m4a,Pagmaragul ku nung makananu kalawut ing disan mu.
C:\Users\Angelica\Documents\GitHub\Pamagsalin_Model_Training\data\Audio_Files\(027) Stephanie\cat12_entry014_spk027.m4a,"Dakal a salamat, dakal yang  kabaldugan neng ibat ya keka."
C:\Users\Angelica\Documents\GitHub\Pamagsalin_Model_Training\data\Audio_Files\(027) Stephanie\cat12_entry015_spk027.m4a,Mebigla ku keng balita. Mengaylangan kung oras ban i prosesu ita
C:\Users\Angelica\Documents\GitHub\Pamagsalin_Model_Training\data\Audio_Files\(027) Stephanie\cat12_entry016_spk027.m4a,"Kwanan mu ngan ing oras a kaylangan mu, ing pagprosesu mangaylangan ya namang oras."
C:\Users\Angelica\Documents\GitHub\Pamagsalin_Model_Training\data\Audio_Files\(027) Stephanie\cat12_entry017_spk027.m4a,Lupa yang buysit oneng e ya bisang makisabi.
C:\Users\Angelica\Documents\GitHub\Pamagsalin_Model_Training\data\Audio_Files\(027) Stephanie\cat12_entry018_spk027.m4a,"Siguru, kaylangan na pang magdili-dili."
C:\Users\Angelica\Documents\GitHub\Pamagsalin_Model_Training\data\Audio_Files\(027) Stephanie\cat12_entry019_spk027.m4a,Isip ku balang metung dapat atin la pang pangadwang tsansa.
C:\Users\Angelica\Documents\GitHub\Pamagsalin_Model_Training\data\Audio_Files\(027) Stephanie\cat12_entry020_spk027.m4a,"Tutu, magbayu la deng tau, ampon mangalilangan yang oras ban sumulung."
C:\Users\Angelica\Documents\GitHub\Pamagsalin_Model_Training\data\Audio_Files\(034) Mia\cat07_entry001_spk034.m4a,"Megshopping ku napun, oneng asna kamal ngan."
C:\Users\Angelica\Documents\GitHub\Pamagsalin_Model_Training\data\Audio_Files\(034) Mia\cat07_entry002_spk034.m4a,Asubukan mu nang mengutang bawas?
C:\Users\Angelica\Documents\GitHub\Pamagsalin_Model_Training\data\Audio_Files\(034) Mia\cat07_entry003_spk034.m4a,"Wa, sabi ku, “pweding dinan bawas nung marakal ku salwan?”"
C:\Users\Angelica\Documents\GitHub\Pamagsalin_Model_Training\data\Audio_Files\(034) Mia\cat07_entry004_spk034.m4a,Sinabi da apin na ita ing presyu.
C:\Users\Angelica\Documents\GitHub\Pamagsalin_Model_Training\data\Audio_Files\(034) Mia\cat07_entry005_spk034.m4a,"Kasakit na, parati ku kasing lalawe presyu online bayu sali."
C:\Users\Angelica\Documents\GitHub\Pamagsalin_Model_Training\data\Audio_Files\(034) Mia\cat07_entry006_spk034.m4a,Yaku rin. Misan mas mura pa online kesa pisalwanan.
C:\Users\Angelica\Documents\GitHub\Pamagsalin_Model_Training\data\Audio_Files\(034) Mia\cat07_entry007_spk034.m4a,Tutu. Tatanggap la namang gcash?
C:\Users\Angelica\Documents\GitHub\Pamagsalin_Model_Training\data\Audio_Files\(034) Mia\cat07_entry008_spk034.m4a,"Wa, tanggap lang gcash ampon credit cards."
C:\Users\Angelica\Documents\GitHub\Pamagsalin_Model_Training\data\Audio_Files\(034) Mia\cat07_entry009_spk034.m4a,"Awa, misan akalingwan ke ing pitaka ku anya e ku mekapamayad counter."
C:\Users\Angelica\Documents\GitHub\Pamagsalin_Model_Training\data\Audio_Files\(034) Mia\cat07_entry010_spk034.m4a,Aru! Peburen daka ban mamabayad kabalik?
C:\Users\Angelica\Documents\GitHub\Pamagsalin_Model_Training\data\Audio_Files\(034) Mia\cat07_entry011_spk034.m4a,"Wa, oneng makarine. Mas masanting ing ligtas kesa keng magsisi."
C:\Users\Angelica\Documents\GitHub\Pamagsalin_Model_Training\data\Audio_Files\(034) Mia\cat07_entry012_spk034.m4a,Mekatadwa ka mesingil keng metung a bage?
C:\Users\Angelica\Documents\GitHub\Pamagsalin_Model_Training\data\Audio_Files\(034) Mia\cat07_entry013_spk034.m4a,"Wa! Yaku mu naman anyang milabas a bulan, mengutang kung refund."
C:\Users\Angelica\Documents\GitHub\Pamagsalin_Model_Training\data\Audio_Files\(034) Mia\cat07_entry014_spk034.m4a,Kalambat da reng refund e.
C:\Users\Angelica\Documents\GitHub\Pamagsalin_Model_Training\data\Audio_Files\(034) Mia\cat07_entry015_spk034.m4a,Inya pin mas buri kung gumamit cash patse malyari.
C:\Users\Angelica\Documents\GitHub\Pamagsalin_Model_Training\data\Audio_Files\(034) Mia\cat07_entry016_spk034.m4a,"Patse atin kang loyalty card, mamye lang puntos ustung sali ka."
C:\Users\Angelica\Documents\GitHub\Pamagsalin_Model_Training\data\Audio_Files\(034) Mia\cat07_entry017_spk034.m4a,Tutu. Menipun kung puntus para keng libri.
C:\Users\Angelica\Documents\GitHub\Pamagsalin_Model_Training\data\Audio_Files\(034) Mia\cat07_entry018_spk034.m4a,"Maswerti ka! Kanita, apitna ke ing sweldu ku kareng gadyet."
C:\Users\Angelica\Documents\GitHub\Pamagsalin_Model_Training\data\Audio_Files\(034) Mia\cat07_entry019_spk034.m4a,Susubukan ku ping mamadyet ngeni oneng e na milyari.
C:\Users\Angelica\Documents\GitHub\Pamagsalin_Model_Training\data\Audio_Files\(034) Mia\cat07_entry020_spk034.m4a,Makanyan ku naman. Masanting nang magplanu kesa magisan ing pera.
C:\Users\Angelica\Documents\GitHub\Pamagsalin_Model_Training\data\Audio_Files\(034) Mia\cat08_entry001_spk034.m4a,O! Komusta naka?
C:\Users\Angelica\Documents\GitHub\Pamagsalin_Model_Training\data\Audio_Files\(034) Mia\cat08_entry002_spk034.m4a,"Mayap kumu, okupadu mu keng obra."
C:\Users\Angelica\Documents\GitHub\Pamagsalin_Model_Training\data\Audio_Files\(034) Mia\cat08_entry003_spk034.m4a,Awa yaku man. Lilibut ka ata?
C:\Users\Angelica\Documents\GitHub\Pamagsalin_Model_Training\data\Audio_Files\(034) Mia\cat08_entry004_spk034.m4a,"E masyadu, atyu kumu maralas bale."
C:\Users\Angelica\Documents\GitHub\Pamagsalin_Model_Training\data\Audio_Files\(034) Mia\cat08_entry005_spk034.m4a,"Awa, misan mas masanting magrelax."
C:\Users\Angelica\Documents\GitHub\Pamagsalin_Model_Training\data\Audio_Files\(034) Mia\cat08_entry006_spk034.m4a,Tutu! Akayabe mu la pa reng kaluguran ta kanita?
C:\Users\Angelica\Documents\GitHub\Pamagsalin_Model_Training\data\Audio_Files\(034) Mia\cat08_entry007_spk034.m4a,"Wa, mikit kami balang kadwang duminggu."
C:\Users\Angelica\Documents\GitHub\Pamagsalin_Model_Training\data\Audio_Files\(034) Mia\cat08_entry008_spk034.m4a,Awa santing! Amiss kula reng pamitipun.
C:\Users\Angelica\Documents\GitHub\Pamagsalin_Model_Training\data\Audio_Files\(034) Mia\cat08_entry009_spk034.m4a,Tuki ka keng tutuki!
C:\Users\Angelica\Documents\GitHub\Pamagsalin_Model_Training\data\Audio_Files\(034) Mia\cat08_entry010_spk034.m4a,Buri ke ita. Mumunta ka kareng cafe kanita?
C:\Users\Angelica\Documents\GitHub\Pamagsalin_Model_Training\data\Audio_Files\(034) Mia\cat08_entry011_spk034.m4a,"Wa, itang malapit king park."
C:\Users\Angelica\Documents\GitHub\Pamagsalin_Model_Training\data\Audio_Files\(034) Mia\cat08_entry012_spk034.m4a,Buri ku keng lugal ayta.
C:\Users\Angelica\Documents\GitHub\Pamagsalin_Model_Training\data\Audio_Files\(034) Mia\cat08_entry013_spk034.m4a,Taimik karin at manyaman ing kape.
C:\Users\Angelica\Documents\GitHub\Pamagsalin_Model_Training\data\Audio_Files\(034) Mia\cat08_entry014_spk034.m4a,Asubukan mu ne ing bayu dang menu?
C:\Users\Angelica\Documents\GitHub\Pamagsalin_Model_Training\data\Audio_Files\(034) Mia\cat08_entry015_spk034.m4a,"Ali pa, metung mu ing oorderan ku keta."
C:\Users\Angelica\Documents\GitHub\Pamagsalin_Model_Training\data\Audio_Files\(034) Mia\cat08_entry016_spk034.m4a,"Yaku rin, e ku maglibe order."
C:\Users\Angelica\Documents\GitHub\Pamagsalin_Model_Training\data\Audio_Files\(034) Mia\cat08_entry017_spk034.m4a,Lumibut tamu keng tutuking duminggu.
C:\Users\Angelica\Documents\GitHub\Pamagsalin_Model_Training\data\Audio_Files\(034) Mia\cat08_entry018_spk034.m4a,Kasaya na nita! Nanung aldo ing magsilbi ka?
C:\Users\Angelica\Documents\GitHub\Pamagsalin_Model_Training\data\Audio_Files\(034) Mia\cat08_entry019_spk034.m4a,Sabadu ing masanting.
C:\Users\Angelica\Documents\GitHub\Pamagsalin_Model_Training\data\Audio_Files\(034) Mia\cat08_entry020_spk034.m4a,"Awa, pabalwan daka keng detalye."
C:\Users\Angelica\Documents\GitHub\Pamagsalin_Model_Training\data\Audio_Files\(034) Mia\cat09_entry001_spk034.m4a,Komusta na ka?
C:\Users\Angelica\Documents\GitHub\Pamagsalin_Model_Training\data\Audio_Files\(034) Mia\cat09_entry002_spk034.m4a,Nokarin ka makatuknang?
C:\Users\Angelica\Documents\GitHub\Pamagsalin_Model_Training\data\Audio_Files\(034) Mia\cat09_entry003_spk034.m4a,"Ot kaburi mung panigaralan ing Spanish ngeni, kaybat dareng milabas a banwa?"
C:\Users\Angelica\Documents\GitHub\Pamagsalin_Model_Training\data\Audio_Files\(034) Mia\cat09_entry004_spk034.m4a,Kapilan mu araramdaman a masipag ka neng abak o neng bengi na?
C:\Users\Angelica\Documents\GitHub\Pamagsalin_Model_Training\data\Audio_Files\(034) Mia\cat09_entry005_spk034.m4a,Ninung menuru keka nung makananung maglutung manyaman a pasta?
C:\Users\Angelica\Documents\GitHub\Pamagsalin_Model_Training\data\Audio_Files\(034) Mia\cat09_entry006_spk034.m4a,Nanung klasing libru ing buri mung babasan istung ala kang gagawan?
C:\Users\Angelica\Documents\GitHub\Pamagsalin_Model_Training\data\Audio_Files\(034) Mia\cat09_entry007_spk034.m4a,Nokaring pipanganan ing pupuntalan mu neng bisa kang mangang maparas a pamangan?
C:\Users\Angelica\Documents\GitHub\Pamagsalin_Model_Training\data\Audio_Files\(034) Mia\cat09_entry008_spk034.m4a,Makananu meng sasamasan ing oras mu ban maging yang masalese agyang okupadu ka iskedyul?
C:\Users\Angelica\Documents\GitHub\Pamagsalin_Model_Training\data\Audio_Files\(034) Mia\cat09_entry009_spk034.m4a,Ot ali ka minta keng pamitipun napun? Masalese na ngan?
C:\Users\Angelica\Documents\GitHub\Pamagsalin_Model_Training\data\Audio_Files\(034) Mia\cat09_entry010_spk034.m4a,"Nokarin ka meragul, ampon makananu ya ing kayanakan mu kanita?"
C:\Users\Angelica\Documents\GitHub\Pamagsalin_Model_Training\data\Audio_Files\(034) Mia\cat09_entry011_spk034.m4a,Nanung peka buri mung gagawan neng bisa kang mag-relax kaybat na ning makaba at mapagal a aldo?
C:\Users\Angelica\Documents\GitHub\Pamagsalin_Model_Training\data\Audio_Files\(034) Mia\cat09_entry012_spk034.m4a,Ninu ing taung memyeng marakal a inspirasyun king kekang bie?
C:\Users\Angelica\Documents\GitHub\Pamagsalin_Model_Training\data\Audio_Files\(034) Mia\cat09_entry013_spk034.m4a,Kapilan ka megumpisang tinukup gitara ampon makananu kalwat bayu ka mebyasa?
C:\Users\Angelica\Documents\GitHub\Pamagsalin_Model_Training\data\Audio_Files\(034) Mia\cat09_entry014_spk034.m4a,"Para keka, bakit dakal la reng tau a magkasakit sasamasan ing karelang oras?"
C:\Users\Angelica\Documents\GitHub\Pamagsalin_Model_Training\data\Audio_Files\(034) Mia\cat09_entry015_spk034.m4a,Makananu ka karalas mamunduk ampong nokarin ya ing pekaburi mung dadalanan?
C:\Users\Angelica\Documents\GitHub\Pamagsalin_Model_Training\data\Audio_Files\(034) Mia\cat09_entry016_spk034.m4a,Nanung pelikula ing arekomenda mu a masayang alben king bengi?
C:\Users\Angelica\Documents\GitHub\Pamagsalin_Model_Training\data\Audio_Files\(034) Mia\cat09_entry017_spk034.m4a,Ninu ing taung tauli mung pakisabyan bayu ka matudtud nabengi?
C:\Users\Angelica\Documents\GitHub\Pamagsalin_Model_Training\data\Audio_Files\(034) Mia\cat09_entry018_spk034.m4a,Nanu la reng bage a magpasikan keka ban akabyusan mu la reng masasakit a aldo?
C:\Users\Angelica\Documents\GitHub\Pamagsalin_Model_Training\data\Audio_Files\(034) Mia\cat09_entry019_spk034.m4a,Nokarin ku kaya manakit pekamalapit a botika a makabuklat pa king oras ayni?
C:\Users\Angelica\Documents\GitHub\Pamagsalin_Model_Training\data\Audio_Files\(034) Mia\cat09_entry020_spk034.m4a,Kapilan ka tauling sinubuk bayung bage?
C:\Users\Angelica\Documents\GitHub\Pamagsalin_Model_Training\data\Audio_Files\(033) Ayanna\cat10_entry001_spk033.m4a,Atyu naka keng mall?
C:\Users\Angelica\Documents\GitHub\Pamagsalin_Model_Training\data\Audio_Files\(033) Ayanna\cat10_entry002_spk033.m4a,"Ali pa, maglakad ku ibat  keng bus stop ngeni."
C:\Users\Angelica\Documents\GitHub\Pamagsalin_Model_Training\data\Audio_Files\(033) Ayanna\cat10_entry003_spk033.m4a,Sanung pasbul ing gagamitan mu?
C:\Users\Angelica\Documents\GitHub\Pamagsalin_Model_Training\data\Audio_Files\(033) Ayanna\cat10_entry004_spk033.m4a,"Ita keng malapit food court, mas malapit ya."
C:\Users\Angelica\Documents\GitHub\Pamagsalin_Model_Training\data\Audio_Files\(033) Ayanna\cat10_entry005_spk033.m4a,"Sige, panenayan daka keng escalator."
C:\Users\Angelica\Documents\GitHub\Pamagsalin_Model_Training\data\Audio_Files\(033) Ayanna\cat10_entry006_spk033.m4a,Ibat ka keng bandang pangulu o bandang mauli?
C:\Users\Angelica\Documents\GitHub\Pamagsalin_Model_Training\data\Audio_Files\(033) Ayanna\cat10_entry007_spk033.m4a,"Ibat ku keng mauli, malala ya ing trapik."
C:\Users\Angelica\Documents\GitHub\Pamagsalin_Model_Training\data\Audio_Files\(033) Ayanna\cat10_entry008_spk033.m4a,Akikit me ing fountain keng libutad?
C:\Users\Angelica\Documents\GitHub\Pamagsalin_Model_Training\data\Audio_Files\(033) Ayanna\cat10_entry009_spk033.m4a,"Wa, limpasan ku ne ngeni."
C:\Users\Angelica\Documents\GitHub\Pamagsalin_Model_Training\data\Audio_Files\(033) Ayanna\cat10_entry010_spk033.m4a,"Likoru ka king wanan kaybat ning fountain, atyu ya ing escalator karin."
C:\Users\Angelica\Documents\GitHub\Pamagsalin_Model_Training\data\Audio_Files\(033) Ayanna\cat10_entry011_spk033.m4a,"Ikwa ku ne, mukyat naku kanyan."
C:\Users\Angelica\Documents\GitHub\Pamagsalin_Model_Training\data\Audio_Files\(033) Ayanna\cat10_entry012_spk033.m4a,Atsu na ka pin keng kadwang palapag?
C:\Users\Angelica\Documents\GitHub\Pamagsalin_Model_Training\data\Audio_Files\(033) Ayanna\cat10_entry013_spk033.m4a,"Wa, makatuknang ku malapit keng bookstore."
C:\Users\Angelica\Documents\GitHub\Pamagsalin_Model_Training\data\Audio_Files\(033) Ayanna\cat10_entry014_spk033.m4a,"Sige, lumakad naku papunta ken."
C:\Users\Angelica\Documents\GitHub\Pamagsalin_Model_Training\data\Audio_Files\(033) Ayanna\cat10_entry015_spk033.m4a,Akikit mu kung menibat keng kayli?
C:\Users\Angelica\Documents\GitHub\Pamagsalin_Model_Training\data\Audio_Files\(033) Ayanna\cat10_entry016_spk033.m4a,"Ali pa, lalawen kula reng tau."
C:\Users\Angelica\Documents\GitHub\Pamagsalin_Model_Training\data\Audio_Files\(033) Ayanna\cat10_entry017_spk033.m4a,Pepepe ku ngeni ban akakit mu ku.
C:\Users\Angelica\Documents\GitHub\Pamagsalin_Model_Training\data\Audio_Files\(033) Ayanna\cat10_entry018_spk033.m4a,Ayta pala ika! Lumapit naku.
C:\Users\Angelica\Documents\GitHub\Pamagsalin_Model_Training\data\Audio_Files\(033) Ayanna\cat10_entry019_spk033.m4a,Lumakad tamu diretsu keng food court.
C:\Users\Angelica\Documents\GitHub\Pamagsalin_Model_Training\data\Audio_Files\(033) Ayanna\cat10_entry020_spk033.m4a,Atyu ya mu keng wanan.
C:\Users\Angelica\Documents\GitHub\Pamagsalin_Model_Training\data\Audio_Files\(033) Ayanna\cat11_entry001_spk033.m4a,Malyari meng pakidwag kanaku ing charger keng lamesa? Kaylangan keng i-charge ing selpon ku ngeni.
C:\Users\Angelica\Documents\GitHub\Pamagsalin_Model_Training\data\Audio_Files\(033) Ayanna\cat11_entry002_spk033.m4a,"O sige, oini na. Pakisabi mu namu kaku nung atin ka pang kailangan."
C:\Users\Angelica\Documents\GitHub\Pamagsalin_Model_Training\data\Audio_Files\(033) Ayanna\cat11_entry003_spk033.m4a,"E me kakalingwang isara ing pasbul kalako mu, lalu na nung alang tau keng bale."
C:\Users\Angelica\Documents\GitHub\Pamagsalin_Model_Training\data\Audio_Files\(033) Ayanna\cat11_entry004_spk033.m4a,"Uwa, siguraduan kung maka sara ya, salamat keng paganaka"
C:\Users\Angelica\Documents\GitHub\Pamagsalin_Model_Training\data\Audio_Files\(033) Ayanna\cat11_entry005_spk033.m4a,Malyari mukung sopan ipanik deng bag areni? Milalu la kasi mabayat para kanaku.
C:\Users\Angelica\Documents\GitHub\Pamagsalin_Model_Training\data\Audio_Files\(033) Ayanna\cat11_entry006_spk033.m4a,Alang problema. Ibwat ko deng aliwa ban mas maligwa keka.
C:\Users\Angelica\Documents\GitHub\Pamagsalin_Model_Training\data\Audio_Files\(033) Ayanna\cat11_entry007_spk033.m4a,Malyari meng i-email ing report kanaku bayu miras alas singku? Bantang a-review ke pa bayu ing pulung.
C:\Users\Angelica\Documents\GitHub\Pamagsalin_Model_Training\data\Audio_Files\(033) Ayanna\cat11_entry008_spk033.m4a,"Awa sige, ibie ke keka bayu ita. Sana makasaup ya keka king pulung."
C:\Users\Angelica\Documents\GitHub\Pamagsalin_Model_Training\data\Audio_Files\(033) Ayanna\cat11_entry009_spk033.m4a,"Panayan muku keng arap, kwanan kemu ing jacket ku kayi lumwal nku."
C:\Users\Angelica\Documents\GitHub\Pamagsalin_Model_Training\data\Audio_Files\(033) Ayanna\cat11_entry010_spk033.m4a,"E ka mamaligwa, panenayan daka keni"
C:\Users\Angelica\Documents\GitHub\Pamagsalin_Model_Training\data\Audio_Files\(033) Ayanna\cat11_entry011_spk033.m4a,Malyari meng palino pasibayu ing sinabi mu? Ali ke kasi ikwa nung nanung buri mung sabyan.
C:\Users\Angelica\Documents\GitHub\Pamagsalin_Model_Training\data\Audio_Files\(033) Ayanna\cat11_entry012_spk033.m4a,O sige. Sabyan keng mas malino keka ngeni
C:\Users\Angelica\Documents\GitHub\Pamagsalin_Model_Training\data\Audio_Files\(033) Ayanna\cat11_entry013_spk033.m4a,Tuknang kapa mag-scroll tsaka ka makiramdam. Atin kung sabyang maulaga.
C:\Users\Angelica\Documents\GitHub\Pamagsalin_Model_Training\data\Audio_Files\(033) Ayanna\cat11_entry014_spk033.m4a,"Ay, panupaya.  Makiramdam naku, nanu ya ing sabyan mu?"
C:\Users\Angelica\Documents\GitHub\Pamagsalin_Model_Training\data\Audio_Files\(033) Ayanna\cat11_entry015_spk033.m4a,"Malyaring bagalan me ing pamagasalita mu ban antindyan daka, ali ke mumunang lengguwahe ing Inglis."
C:\Users\Angelica\Documents\GitHub\Pamagsalin_Model_Training\data\Audio_Files\(033) Ayanna\cat11_entry016_spk033.m4a,"Ah, uwa.. Bagalan kuna. Pasensya naka ne."
C:\Users\Angelica\Documents\GitHub\Pamagsalin_Model_Training\data\Audio_Files\(033) Ayanna\cat11_entry017_spk033.m4a,"Paganaka mu kanaku a tugtugan ko deng tanaman bukas abak, pota langi no naman."
C:\Users\Angelica\Documents\GitHub\Pamagsalin_Model_Training\data\Audio_Files\(033) Ayanna\cat11_entry018_spk033.m4a,Alang problema. Mumunang sabyan ku keka ita kinabukasan
C:\Users\Angelica\Documents\GitHub\Pamagsalin_Model_Training\data\Audio_Files\(033) Ayanna\cat11_entry019_spk033.m4a,"Sabyan mu ing tutu kanaku, mas buri kung damdaman direkta ing tutu."
C:\Users\Angelica\Documents\GitHub\Pamagsalin_Model_Training\data\Audio_Files\(033) Ayanna\cat11_entry020_spk033.m4a,"Respetwan ku ita, ala kung sasalikut keka."
C:\Users\Angelica\Documents\GitHub\Pamagsalin_Model_Training\data\Audio_Files\(033) Ayanna\cat12_entry001_spk033.m4a,Pasalamat ku king dakal a suportang tinggap ku kabang daralan kung masakit a panaun.
C:\Users\Angelica\Documents\GitHub\Pamagsalin_Model_Training\data\Audio_Files\(033) Ayanna\cat12_entry002_spk033.m4a,"Inarap meng masalese, akakit ke."
C:\Users\Angelica\Documents\GitHub\Pamagsalin_Model_Training\data\Audio_Files\(033) Ayanna\cat12_entry003_spk033.m4a,"Ing pelikulang ayta, e ke asahan, ginaga ku pin."
C:\Users\Angelica\Documents\GitHub\Pamagsalin_Model_Training\data\Audio_Files\(033) Ayanna\cat12_entry004_spk033.m4a,"Yaku man, lakwas yang malungkut pala ita keng asahan ku."
C:\Users\Angelica\Documents\GitHub\Pamagsalin_Model_Training\data\Audio_Files\(033) Ayanna\cat12_entry005_spk033.m4a,Mabubusit ku ustung deng aliwang tau e la makiramdam bayu la salangsang.
C:\Users\Angelica\Documents\GitHub\Pamagsalin_Model_Training\data\Audio_Files\(033) Ayanna\cat12_entry006_spk033.m4a,"Ayntindyan daka, dakal bisang magsalita pero ditak la mu ding bisang makiramdam."
C:\Users\Angelica\Documents\GitHub\Pamagsalin_Model_Training\data\Audio_Files\(033) Ayanna\cat12_entry007_spk033.m4a,Neng ka sigasig keng pamanyaup keng kapaligiran.
C:\Users\Angelica\Documents\GitHub\Pamagsalin_Model_Training\data\Audio_Files\(033) Ayanna\cat12_entry008_spk033.m4a,Tatalangan ke ing dedikasyun na.
C:\Users\Angelica\Documents\GitHub\Pamagsalin_Model_Training\data\Audio_Files\(033) Ayanna\cat12_entry009_spk033.m4a,"Kakarug ku bayu ing interbyu, oneng masalese neman"
C:\Users\Angelica\Documents\GitHub\Pamagsalin_Model_Training\data\Audio_Files\(033) Ayanna\cat12_entry010_spk033.m4a,Ikit mo? Mas preparadu ka kesa keng inisip mu.
