kapampangan,english
malambat neng e susulat kaku i tom.,tom hasn't written to me in a long time.
linikas neng tom king pranses ing kontrata.,tom translated the contract into french.
manakit la king madalumdum deng pusa.,cats have the ability to see in the dark.
balu mung atin yang aliwang pakikitan i tom?,did you know tom was seeing someone else?
pepamunikala nang magumpisa keng tambing.,he proposed that we should start at once.
pepamunikala nang magumpisa tamung tambing.,he proposed that we should start at once.
pepawaga nang magumpisa keng tambing.,he proposed that we should start at once.
pepawaga nang magumpisa tamung tambing.,he proposed that we should start at once.
eku atatandanan nung nu ko binili deng susi ning kotsi ku.,i don't remember where i put my car keys.
buri ku mung abalu mung ligtas ya i tom.,i just want you to know that tom is safe.
sabian ku kaya king ustung panaun.,i will tell it to him at the proper time.
i tom ing sinabi kaku king milyari.,it was tom who told me what had happened.
paki-isplika mo kaku deng patakaran ning soccer.,please explain the rules of soccer to me.
"masikan yang memakbung ing ""time bomb"".",the time bomb exploded with a loud noise.
ditak la reng anak king kwartu.,there were few children in the classroom.
apisamut-samut mo reng miyayaliwang pamangan king blender.,you can mix different foods in a blender.
"sinabi mu na kang tom ing tutu, e wari?","you have told tom the truth, haven't you?"
ala yang gagawan nune manalbeng tv patingapun.,he does nothing but watch tv all day long.
meyari ya king matas a pipagaralan ngening kasibul.,he graduated from high school this spring.
eke man balu ing pilidu nang tom.,i don't even know what tom's last name is.
eku buri ing samantalanan daku.,i don't want them to take advantage of me.
eku bisang pasamantala karela.,i don't want them to take advantage of me.
mag-exercise ku uling bisa kung manatiling masanting katawan.,i exercise because i want to stay healthy.
mag-exercise ku uling bisa kung manatiling masanting mabulas.,i exercise because i want to stay healthy.
paraman daka nung makananu karakal a pera ing buri mu.,i will lend you as much money as you want.
e kaylangang tumagun king pulung ngeni i tom.,tom doesn't have to be at today's meeting.
gisan neng tom ing kape na at meko ya bang magobra.,tom finished his coffee and left for work.
bala nang tom atyu ku boston anyang milabasan a duminggu.,tom thinks that i was in boston last week.
pane keng mamyalung tennis neng sabadung abak.,we always play tennis on saturday morning.
pilan kaming oras mipamakibat tungkul king isulat.,we disputed for hours about what to write.
maygit nakeng atlung pulung banwang miyasawa.,we've been married more than thirty years.
nanung malyaring misnang kagrabi?,what's going to happen that's so terrible?
eka manakit asung mas maragul kesa kaniti.,you won't find a dog bigger than this one.
king palage mu bage kaku ing ating bigote?,do you think i'd look good with a mustache?
merakap ya uling penako na ing pera.,he was arrested because he stole the money.
datang ya keng gatpanapun ning a-singku.,he will arrive on the afternoon of the 5th.
eku balung e makaintinding pranses i tom.,i didn't know tom didn't understand french.
kaylangan kung abalu nung kapilan ya magbalak mako i tom.,i have to find out when tom plans to leave.
balamu e interesadu kanyan i tom.,it looks like tom isn't interested in that.
e re pa ikit deng pengari ku ing tau ku.,my parents still haven't met my girlfriend.
mikawani ya i tom ampo i mary kaybat nang mete ning anak dang lalaki.,tom and mary split up after their son died.
i tom mu kabud ing taung makasaup kaku ngeni.,tom is the only person who can help me now.
ginamit kaming mapa king byahi mi.,we made use of the maps during our journey.
sabyan tamu kang tom ing eganaganang kaylangan nang abalu.,we'll tell tom everything he needs to know.
numanu tamu keng tutuki tang bakasyun?,what should we do during our next vacation?
bisa ka pang patatas?,would you like another helping of potatoes?
makapagparla kang karagdagagan impormasyun king e-mail?,could you send me more information by email?
"tawli yang dinatang, anti ing maralas nang gagawan.","he came late, as is often the case with him."
eku bisang magobra nung makanyan ing kabilyan.,i don't want to work under these conditions.
sabi ku karela ala lang kaylangang gawan.,i told them they didn't have to do anything.
palako naku anyang tigtig ya ing timbre.,i was about to leave when the doorbell rang.
alus kasindagul ne ning grecia ing estado ning new york.,new york state is almost as large as greece.
"kwanan me ing pekaburi mu, anggyang sanu.","take the one you like best, whichever it is."
deta deng anak a dininan mung libru.,those are the children you gave the book to.
nanung kakanan nang tom neng minindal?,what does tom eat for a mid-afternoon snack?
pilan la pang bilungan deng basan mu pa?,how many more pages do you have left to read?
palage ku e masyadung makabaldugan kang tom ing regalu ku.,i don't think my gift meant very much to tom.
king palage ku eta miras boston bayu dalumdum.,i don't think we'll reach boston before dark.
e milyari ing dakal king karelang sinulat.,much of what they wrote about never happened.
gagawan de ing bayung tete.,the new bridge is in process of construction.
migdisisyun lang mandatun king karulun ning london.,they decided to settle in a suburb of london.
atlu yang oras king gym i tom napun.,tom was at the gym for three hours yesterday.
e lumbat misane kang mamangan pamangan apon.,you'll soon get used to eating japanese food.
gewa da reng doctor ing eganagana ba yang maulu.,doctors did everything they could to cure him.
eku balung sadya kang makatuknang king boston.,i didn't know that you used to live in boston.
ing pacifico ing pekamaragul a kadayatmalatan king yatu,the pacific is the largest ocean in the world.
balamu bangungut ing milyari king vietnam.,what happened in vietnam was like a bad dream.
"ating daratang a tsunami, anya sana magsadya kayu.","a tsunami is coming, so please be on the alert."
ing broccoli ing metung kareng pekamasanting a gule para keka.,broccoli is one of the best vegetables for you.
akilala ke ing tau ku ngeni king gym.,i got to know my current girlfriend at the gym.
minta la king mal a restoran bang maugtu.,they went to an expensive restaurant for lunch.
eraku inagkat di tom ampong king karelang kasal.,tom and mary didn't invite me to their wedding.
malinong masikan ya kapanamdaman kaniti i tom.,tom obviously feels very passionate about this.
titigtig yang pyanu i tom anyang mas anak ya pa.,tom used to play the piano when he was younger.
bisa ya pang maglambat pilang aldo i tom.,tom wanted to stick around for a few more days.
makatatlu la karakal deng libru ning kapatad kung babai kesa kaku.,my sister has three times as many books as i do.
ating helicopter a manaya kekatamu king bubungan.,there's a helicopter waiting for us on the roof.
eno ingatan masaleseng tom deng anak na.,tom doesn't take very good care of his children.
sana lumbat yang adwang duminggu i tom.,we hope tom sticks around for a couple of weeks.
nanung dapat mung gawan nung meket kang cobra?,what should you do if you are bitten by a cobra?
nanung paninapan mu anyang ginising daka?,what were you dreaming about when i woke you up?
mibulus ya kaybat ning limang banwang pangasukul.,he was set free after doing five years in prison.
ot karakal mu balu king kasalesayan ning japan?,how come you know so much about japanese history?
"king palage mu, pilan lareng hotel king boston?",how many hotels do you think there are in boston?
"taganang buri ke, oneng deng barkada na ali kula.","i really like him, but not his circle of friends."
payaus daka kaya kabud datang ya.,i will have him call you the moment he gets back.
isplika ku angga king agyu ku.,i'll try to explain it to the best of my ability.
komusta la reng lisyun mu king pranses?,how are you coming along with your french lessons?
mibulus ya kanu kaybat ning limang banwa king sukulan.,i hear he was released after five years in prison.
bisa kung mangasanting a sampaga king lamesa.,i want some beautiful flowers to put on the table.
buri ku ingatan me pamu i tom.,i want you to take care of tom for a little while.
"nung ating malyari, datang kami kilub ning atlung minutu.","if anything happens, we'll be in in three seconds."
sinilip ya i tom king pasbul ba nang akit ing malilyari.,tom peeked out the door to see what was happening.
eke pa mikit manibat anyang magaral kami.,we have not seen each other since our school days.
eku man balung sadya kang makatuknang king boston.,i didn't even know that you used to live in boston.
akalingwan kung sabian kang tom a eku balak munta karin.,i forgot to tell tom i wasn't planning to be there.
metung ku neng oras panayan ing kaluguran ku.,i've been waiting for a friend of mine for an hour.
"kareng adwang pulung istudyanti, metung ya mu ing mekabasa king libru.","out of twenty students, only one has read the book."
ene atatandanan tom ing lagyu ning mestra na anyang kindergarten.,tom can't remember his kindergarten teacher's name.
ene man tinext tom i mary a mitawli ya.,tom didn't even text mary to tell her he'd be late.
pasake ne king kotsi na i tom anyang mebaril ya.,tom was about to get into his car when he was shot.
ika ing pekamalagung babai king yatu.,you're the most beautiful woman in the whole world.
eta kakalingwan a e makaintinding pranses i tom.,let's not forget that tom doesn't understand french.
balamu kasing-idad me ing anak a lalaki banda karin.,that boy over there looks about the same age as you.
"kilkal ne bulsa ning pulis, oneng ala yang ikit.","the cop went through his pockets, but found nothing."
atin yang pakisabian i tom ngeni. makapanaya ka?,tom is talking with someone right now. can you wait?
siguru ena man apansinan tom a alayu keni i mary.,tom probably won't even notice that mary isn't here.
mete la ngan deng pasaherus anyang mibagsak ya ing eruplanu.,all the passengers were killed in the airplane crash.
akalingwan kong isara deng awang bayu minagyu.,i forgot to shutter the windows before the storm hit.
penyali nakung ima ku kaniting pyalungan anyang walu kung banwa.,my mom bought me this toy when i was eight years old.
mas dakal ing panakitan ning gubyernu kesa king kailangan na.,the government was earning more money than it needed.
mas dakal ing panakitan ning kapamahalan kesa king kailangan na.,the government was earning more money than it needed.
dakal la reng istudyanting e linub ngeni.,there were a lot of students absent from class today.
eno balung itratung masaleng tom deng empleyadu na.,tom doesn't know how to treat his employees properly.
eku pa minum beer neng ugtu.,i've never had a beer in the middle of the day before.
akakit me ing babaing makatikdo king gulut nang tom? i mary ita.,can you see the woman standing behind tom? that's mary.
obat karakal mu balu tungkul king kasalesayan ning hapon?,how is it that you know so much about japanese history?
"kinopya ne ning kaluguran ku ing kakung pagaralan bale, at abalu ning mestra.",my friend copied my homework and the teacher found out.
"kinopya ne ning kaluguran ku ing kakung pagaralan bale, at abalu ning talaturu.",my friend copied my homework and the teacher found out.
"keng tutuki mukung puntalan, pakit ke ing libru.","next time you come to see me, i will show you the book."
kapakibatan ning ima ing panugali dareng anak na.,a mother is responsible for the conduct of her children.
pareu nong miyari king matas a pipagaralan deng adwa kung anak.,both of my kids have already graduated from high school.
"enaku buring pakisabian ngeni, at eku balu nung bakit.","he doesn't want to talk to me now, and i don't know why."
ere apansinang linwal king kwartu.,he went out of the room without being noticed by anyone.
"king pyalung a ini, ere malyaring paldakan deng mamyalung ing bola.","in this game, players were not allowed to kick the ball."
kontra la king planu deng maygit kapitna kareng residenti.,more than half of the residents are opposed to the plan.
magkasakit keng magdisisyun nung sanung salwan.,we're finding it difficult deciding on which one to buy.
"nung alang dios, kaylangan yang imbentuan.","if god did not exist, it would be necessary to invent him."
aliwa mu i tom ing kaylangang magaral. angga yaku kaylangan.,"it's not only tom that has to study. i have to study, too."
inalben ko reng ayup king barkun kabang inuman ke ing kape ku.,i watched the birds on the balcony while drinking my coffee.
"nung e king gera sibil, makwalta no sa ngeni.","if it had not been for civil war, they would be wealthy now."
"nung mako ka ngeni, siguradu kung mirasan kang trapik.","if you leave now, i'm sure you'll be caught in a traffic jam."
"mesakit ya ing kapitan mi, anya yaku ing menalili kaya king pulung.","our captain got sick, so i attended the meeting in his place."
"kuntoru darakal la reng kakilala mu, lakwas diritak ing panaun mung makikit karela.","the more people you know, the less time you have to see them."
ing burj khalifa ing pekamatas a skyscraper ngeni.,burj khalifa is currently the tallest skyscraper in the world.
atin kung pusa ampong asu. matuling ya ing pusa at maputi ya ing asu.,i have a cat and a dog. the cat is black and the dog is white.
"nung masyadu kang malambat magobrang e magpaynawa, panamdaman mu.","if you work too long without a rest, it begins to tell on you."
emo dapat babasan deng sulat dareng tau nung alang paintulut.,you shouldn't read people's private letters without permission.
"palage ku, ika ing pekamalagung babai king mabilug a yatu.",i think you're the most beautiful woman in the whole wide world.
e ligtas keng babai ing lumwal dili na nung mabengi na.,it is not safe for a girl to go out by herself so late at night.
"atin ku sang ikutang, oneng e raka buring pangabalanan.","i have some questions to ask, but i don't want to bother you now."
bala ku atyu dapat king boston i tom. nananu ya keni?,i thought tom was supposed to be in boston. what's he doing here?
eta kakalingwang e tamu agawa ini nune king saup nang tom.,let's not forget we never could have done this without tom's help.
"uli ning pamisapungan, mibalugse ya palual ing metung karing pasaherus.","as a result of the collision, one of the passengers was thrown out."
migaganaka la reng sabla king milyari king sadyang kampyun.,everyone is anxious to know what has become of the former champion.
"mumuna, pisabyan tala deng eksperimentung gagawan da kareng laboratoryu.","first, let us talk about the experiments conducted in laboratories."
"dinusug neng tom ing pasu king kayli, at mibusni ya ing sikretung pasbul.",tom moved the flower pot to the left and the secret door slid open.
"dinusug neng tom ing pasu king kayli, at mibusni ya ing lihim a pasbul.",tom moved the flower pot to the left and the secret door slid open.
"king kabundukan, maygit singkwenta sentimetrung nyebe ing menabu","in the mountain area, snow has fallen more than fifty centimeters deep."
"migigising kung ala sais ning abak, umpisan ke abak kung atyat ke ing katawan ku, lawen ke ing cellphone ku.",i wake up at six o’clock in the morning and start my day with a quick stretch and then check my phone.
karanun naman. magkasakit kang migigising neng abak aldo-aldo?,that’s early. do you find it hard to wake up that early everyday?
"ali naman, mesane naku. kaybat, daretsu naku banyu ban mandilu.","not really, i’ve gotten used to it. after that, i head straight to the bathroom to shower."
"maralas keng nanamnaman ing oras ku balang abak, lakwas na neng sabadu, at duminggu.","i usually tend to take my time in the mornings, especially on weekends."
"e daka sisyan, panga alas syete y medya ning abak mamako naku ban e ku matawli king mumuna kung klasi.","i don’t blame you, i try to be out of the house by 7:30 to avoid being late."
"masanting ya ita. yaku kasi maralas kung mamaligwa, mamangan ka neng bayu ka mako?","that’s smart, i’m often rushing, do you eat before you leave?"
"wa, magsadya ya i ima kung nasi, ebun ampong batirul kabang gagayak kami.","yes, my mom prepares rice, eggs and hot chocolate while we’re getting ready."
"masanting yang daramdaman ita, deng abak kunaman medyu magulu la, nengkayi, e naku mamangan almusal.","that sounds nice. my mornings are a bit more chaotic, sometimes i skip breakfast entirely."
"ing atsi ku ampo yaku, sabe kaming mamangan bayu kami mako bale.",my older sister and i eat together before heading out.
makapasno ita. lalakaran miyang koya ku ing papunta eskuwela.,that must be comforting. i walk to school with my older brother.
"parewu tamu, nang kasanting istung atin kang abe maglakad, lalu na neng abak.","same here! it’s nice having someone to walk with, especially in the morning."
"wapen, istung atsu naku eskuwela, parewu yamu ing iskedyul: inglis, math ampo pe.","agreed, once i’m at school, it’s the usual schedule: english, math, science, and pe."
"yaku man, kayi kayari naning klasi ku, muli naku ban magpaynawa, kayari nanita magrebyu ku kayi gawan ko deng katuldwanan ku.","mine too. and after classes, i go home, rest, then start reviewing and doing assignments."
"madisiplina ka, susubukan ku naman magaral, pero malilibang ku.","you’re disciplined. i try to study too, but sometimes i get distracted."
"ikwa daka keta, kayari manigaral. sosopan ke i ma ku keng apunan","i get that. after studying, i help my mom with dinner."
"keng bale mi naman, sabe-sabe kamin ngan mamangan.","in our house, we all eat together"
"parewu kekami, ini ing metung a peka paburitu kung keng aldo.",same with us. it’s one of my favorite parts of the day.
kaybat apunan? atin ka pang oras para kekang sarili?,and after dinner? do you have free time?
"ditak. mamasa kung libru, manalbe, o mamyalung ku kayabe deng kaluguran ku online.","a bit, i read, watch, or play games with friends online."
"masanting ya ing aldo mu ah, subukan keng tukyan ing rutina mu.",that is a good day. i might try setting up a routine like yours.
mayap a abak! aku y [name]. makuswelu kung mikit-ikit tamu kening kekatang balayan.,good morning! i’m [name]. it’s really great to meet you here at this community event.
mayap a abak! matula kung akilala daka. bayu ka ba keni?,good morning! nice to meet you too. are you new around here?
"wa, kalilipat ku pa mu keting kasumangid bale. aisip kung dapat magumpisa kung magpakilala kareng taung maralas ku kanyang akakit.","yeah, i just moved into the neighborhood recently. i figured i should start introducing myself to the people i’ll probably see often."
masanting yang ideya yan. deng tau keti maganaka la.,that’s a great idea. people around here are pretty nice.
"susubukan kung tumiman, lumawe karing mata da, ampon mangutang nung makananu ya ing aldo ning metung a tau nung akit ke keng mumunang besis.","i always try to smile, make eye contact, and ask how someone’s day has been when i meet them for the first time."
"at ing magalang a pamanatu keng metung a tau, kalupa ning pamangamanung ""mayap a gatpanapun"" potang lulub la keng kwartu.","and politely greeting someone always feels nice, like saying “good afternoon” when they walk into a room."
"gyang aku! nung atin kung bisita, sisiguraduan kung saganan ku la keng pasbul at dinan kung nanu mang inuman o kanan.","same here! when i have guests over, i make sure to welcome them at the door and offer them something to drink or eat."
masanting yan. makanyan ku naman gagawan. abse ke mu naman ing “salamat” kaybat keng akilala ing metung a tau.,that’s good. i do the same. i also make it a habit to say “thank you” after meeting someone.
"tutu pin, lakwas na kareng mas pormal a sitwasyun, kalupa da reng pamitipun. gagamit ka namang pormal a pamag mananu?","true, especially in more formal situations, like meetings. do you use formal greetings too?"
"wa. king propesyunal a lugal, mas buri kung sasabyan ing “mayap a abak, sir’ o kaya naman “mayap a gatpanapun, ma’am.”","yes. in professional settings, i prefer saying things like “good morning, sir” or “good afternoon, ma’am.”."
"tutu pin. potang magpakilala ku keng metung a pamitipun, malino kung sasabyan ing lagyu ku ampon pamalino ku ing kanakung tungkulan o bakit atyu ku karin.","it really does. when i introduce myself in a meeting, i clearly say my name and briefly explain my role or why i’m there."
"at king eskwela naman, maralas ku lang atwan deng mestra ku balang abak. iti ing paralan ku para ipakit ing respetu.","and at school, i always made sure to greet my teachers every morning. it was my way of showing respect."
masanting ita! at nanu ing gagawan mu nung akalingwan me ing lagyu ning metung a tau kaybat meng akatagmu?,that’s great! and what do you do if you forget someone’s name after meeting them?
ing tutu mu? kutnangan ku la mung pasibayu. kaybat subukan kung ganakan keng tutuking panaun.,honestly? i just ask again politely. then i really try to remember it next time.
misan pakilala ku la reng kakaluguran ku keng metung at metung kareng pamitipun ban lakwas lang maging komportabli. gagawan mu naman ita?,i sometimes introduce my friends to one another at events to help them feel more comfortable. do you do that too?
"wa. at nung masalese ing pamipakilala, keraklan mililibe keng numeru ning teleponu o social media handles ban manatili kung makipag-ugnayan.","yes. and if the introduction goes well, i usually exchange phone numbers or social media handles to stay in touch."
"mayap yan! kayi pala, neng manatu ka kareng matwa keng pamilya mu, atin kang gagawang aliwa?","that’s nice! by the way, when you greet older people in your family, do you do anything different?"
"wa, tiru da kung dukung ditak o siklod neng mamye galang kareng makatua, lalu na kareng reunion o neng holidays.","yeah, i was taught to bow a little or nod when greeting elders, especially at reunions or during the holidays."
aku man. metung yang simpleng bage ban plato ing respetu. parati ku la namang kukomustan reng pengari da reng kakaluguran ku neng mamasyal ku karela.,me too. it’s a simple way to show respect. i also always greet my friends’ parents when i visit them.
masaya kung makitalamitam keka. malaus ka keti king balayan!,i enjoyed talking to you. welcome to the neighborhood!
"ing pamilya ku malapit kami king metung at metung. agyang atin kami ngan gagawan, siguraduan ming atin kaming oras ban abe-abe kaming mangan apunan.","my family’s really close with one another. no matter how busy we get, we always make time to have dinner together."
"ikami mu naman. agyang makananu ya kagulu ing aldo, lukluk kami ngan at mangamanu kabang mamangan apunan.","we’re like that too. no matter how chaotic the day gets, we all sit down and talk over dinner."
"atin kung adwang kapatad a lalaki at metung a babai, mipapate kami misan dapot potang atin linwal a seryusung bage, saupan mi ya ing balang metung.","i have two brothers and a sister, we fight sometimes but when something serious comes up, we help each other."
"gyang aku. atin kung atlung kapatad at mipapate kami misan. dapot nung ating importanti, parati kaming atyu para keng balang metung.","same here. i have three siblings, and we bicker sometimes. but when it matters, we always show up for one another."
"at deng pengari ku, miyasawa nalang dakal a banwa at angga man ngeni mikalugud la pa. mag-movie date la pa rin.","and my parents, they’ve been married for over twenty years and they’re still so sweet. they still go on movie dates."
"para kaku, ing weekend ing paborito ku. papasyalan mi la reng apu ku, at mitipun la reng buung pamilya mi. menasa atin pamangan, tula, ampon kwentuan.","for me, weekends are my favorite. we visit my grandparents, and the whole family gathers. there’s always food, laughter, and stories"
"oh, parehu tamu! deng pamitipun mi masigla dapot masaya. deng mapilan kareng makatulang istorya lulwal la kanita.","oh, same! our gatherings are loud but fun. some of the funniest stories come out then."
ala nang masanting pa nung ganakan itang panaung milabas at mipapangayli keng mabilug a bengi.,there’s nothing better than reliving those old memories and laughing all night.
"meragul kung malapit kareng pisan ku. kalupa ming mikakapatad a mipamuklat sikretu, mamialung, at miyabe-abe pagselebran ing aldo ning kebaitan.","i grew up really close to my cousins. we were like siblings sharing secrets, playing games, and celebrating birthdays together."
ikami naman mu makanyan kami. deng pinsan ku ampong aku atin kaming pamiyabe a anting mikakaluguran kami kesa keng kamag-anak.,we are like that too. my cousins and i have a bond that feels more like best friends than relatives.
"neng atin kung panamdaman a malungkut o e ku siguradu, pupuntalan ke i ima ku. ing kayang payul parati yang makasaup kanaku ban sumanting ing pakiramdam ku.","whenever i’m feeling down or unsure, i go to my mom. her advice always helps me feel better."
gyang aku. deng amanu nang ima ku parati lang kailangan kung damdaman. balamu balu na.,same here. my mom’s words are always what i need to hear. it’s like she just knows.
parati ming sisikapan a makipag-ugnayan kareng kamag-anak a marayu. agyang makuyad mung awus dakal ya kabaldugan.,we always try to keep in touch with relatives who live far. even a short call means a lot.
masanting a galo ita. maralas kaming makipag-video call ban manatili ing pamiyabe mi.,that’s a great habit. we always do video calls to keep the bond strong.
i tatang ku metung ya kareng role model ku. dakal ya tiru kaku tungkul keng pamagsumikap at pamagkumbaba.,my dad’s one of my role models. he’s taught me a lot about hard work and being humble.
"ing kanaku mu rin. deng aral na keng bie menatili la kaku, lalu na patungkul ban maging maganaka ampon responsabli.","mine too. his life lessons have stuck with me, especially about being kind and responsible."
