kapampangan,english
kabukas kung makagising a mamasa.,i was up all night reading.
taganang pakisabyan ke i tom.,i'll certainly talk to tom.
eku siguradu nung ikit neng tom.,i'm not sure if tom saw it.
aliwa ita ing amanwan ku.,i'm not talking about that.
taganang makarine.,it was really embarrassing.
siguru dakitan daka.,maybe they'll come for you.
siguru dapat kang kumang metung.,perhaps you should get one.
migpasya yang magdoktor.,she decided to be a doctor.
migdisisyun yang magdoktor.,she decided to be a doctor.
metung yang bantug a magkanta.,she is a well-known singer.
metung yang kabalitan a magkanta.,she is a well-known singer.
metung yang bunying magkanta.,she is a well-known singer.
abayan me saguli i tom.,stay with tom for a moment.
abayan me i tom kening kwartu.,stay with tom in this room.
"kabira-bira, migumpisang minuran.","suddenly, it began to rain."
sabyan mu kang tom papunta ne i mary.,tell tom mary's on the way.
salamat king kekang pamalak.,thank you for your opinion.
salamat king suporta.,thank you for your support.
"salamat king usuk, tom.","thanks for the advice, tom."
"salamat king payu, tom.","thanks for the advice, tom."
salamat king inspirasyun.,thanks for the inspiration.
salamat king pamikatagun.,thanks for the opportunity.
atyu king kayli ing banyu.,the bathroom's on the left.
alus ala yang laman ing tren.,the train was almost empty.
ala pa ing pekamarok.,the worst is still to come.
ini ing ambisyun ku king bye.,this is my life's ambition.
ena mayari ini.,this is never going to end.
"bag me ini, ale?","this is your bag, isn't it?"
"eku kasalanan ini, ale?","this isn't my fault, is it?"
"eku kasalanan ini, e wari?","this isn't my fault, is it?"
"emu kasalanan ini, tom.","this isn't your fault, tom."
taganang makatakut ya ing pelikula.,this movie is really scary.
melakwan ya ini king barkun.,this was left on the porch.
metung mung minutu ini.,this'll only take a minute.
pareu kaming nerbyosung tom.,tom and i are both nervous.
pareu kaming manerbyus tom.,tom and i are both nervous.
mikasundu keng tom.,tom and i had an agreement.
pareu keng munta karing tom.,tom and i'll both be there.
ena balung tom ing katutwan.,tom doesn't know the truth.
mekapag-disisyun ne i tom.,tom has come to a decision.
dapat 2:30 mekauli ne i tom.,tom should be home by 2:30.
megisan na ing pasensya nang tom.,tom's patience has run out.
dakal tamu sukat pagmasusian.,we have a lot to celebrate.
kaylangan tamu ngeni ing sikanan nang tom.,we need tom's strength now.
i neng kai magkamali kami.,we sometimes make mistakes.
neng kai magkamali tamu.,we sometimes make mistakes.
nanung buri mung kanan?,what would you like to eat?
ninung e maki buri king bebe dayatmalat?,who doesn't like the beach?
ot eko pareung sumuku?,why don't you both give up?
pane kang magreklamu.,you are always complaining.
"ustu ka siguru, tom.","you're probably right, tom."
sinabi mu na yan kaku.,you've told me that before.
dakal ka balu tungkul kanita?,do you know much about that?
eme pabureng miyuranan.,don't expose it to the rain.
agyang kapilan sasabyan na ing tutu kaku.,he always told me the truth.
mibagsak ya king pamagsulit bang matanggap.,he failed the entrance exam.
"mibagsak ya king ""entrance examination"".",he failed the entrance exam.
minta ku king boston anyang milabasan a bulan.,i came to boston last month.
eku maybug paniwalan.,i could scarcely believe it.
ala kung dadalang kwalta.,i don't have any cash on me.
mas buri ku ing gatas kesa king katas ning prutas.,i like milk more than juice.
tinulak ke i tom king danum.,i pushed tom into the water.
mako ku keng tutuking duminggu.,i'm leaving early next week.
mas malagu ku kesa keka.,i'm more beautiful than you.
dimdam kune ining kanta kanita.,i've heard this song before.
e maragul a bage ita.,it isn't that big of a deal.
balamu ustu ya i tom.,it looks like tom was right.
e maragul a bage ita.,it's not that big of a deal.
buren mung yatad daka king kotsi mu.,let me walk you to your car.
pagmaragul daku deng pengari ku.,my parents were proud of me.
panupaya mung mitawli ku.,please excuse my being late.
panupaya yung mitawli ku.,please excuse my being late.
panupaya yu pung mitawli ku.,please excuse my being late.
malagu yang babai yan.,that's a good-looking woman.
iro ya ampong gintu ing karelang bandera.,their flag is blue and gold.
asul ya ampong gintu ing karelang bandera.,their flag is blue and gold.
kawangis neng tom i john.,tom kind of looks like john.
leko nong tom deng headphone na.,tom took his headphones off.
buri nang tom kayabe ne i mary.,tom wished he was with mary.
nanung kakanan nang tom neng paugtwan?,what does tom eat for lunch?
atin kang payntunan?,are you looking for somebody?
malyari tayang pisabyan ini kaybat?,can we talk about this later?
gawan mu ing agyu mu at eka migaganaka.,do your best and don't worry.
minta naka mexico?,have you ever been to mexico?
ikit mu ne ing pasaporti nang tom?,have you seen tom's passport?
timpak ne ing bag na king lamesa.,he laid his bag on the table.
taganang masalese yang tigtig pianu.,he plays the piano very well.
mangibili kang sisilyu king kahun.,he put some coins in the box.
mekatapilan naka minta?,how many times have you gone?
eku agyung saling kotsi.,i cannot afford to buy a car.
eku bisang munta king iskwela.,i don't want to go to school.
eku bisang lungub.,i don't want to go to school.
dakal ku credit card.,i have a lot of credit cards.
kaylangan kung manigaral para king pamagsulit.,i have to study for the exam.
ala ku pang apayntun.,i haven't found anything yet.
balu kung maulaga keka.,i know it's important to you.
patingapun ku king kekami napun.,i was home all day yesterday.
eku tatakut kareng maglalage,i'm not frightened of ghosts.
mapagal nakung manaya king pila.,i'm tired of waiting in line.
susubukan kung makatudtud.,i'm trying to get some sleep.
malyari keng andaman ing diksyunaryu mo?,may i borrow your dictionary?
parama'nang diksyunaryo?,may i borrow your dictionary?
balamu alang manibala.,nobody seems to be in charge.
e tana balu nung nanung gawan tamu.,now we don't know what to do.
kulang ya ing metung a amanu.,one language is never enough.
atin yang tatalnan a sampaga.,she has a flower in her hand.
taganang mal ya ing kotsing yan.,that car is really expensive.
makanyan dakung peparagul.,that's just how i was raised.
tinagun ya king boston banwang metung i tom.,tom visited boston last year.
buri neng sagipan tom ing yatu.,tom wanted to save the world.
buri neng iligtas tom ing yatu.,tom wanted to save the world.
buri nakaming makisabi kekang tom.,tom wanted us to talk to you.
e makiramdam kang mary i tom.,tom wasn't listening to mary.
nanung gewa tamu king metung at metung?,what did we do to each other?
atin kang trenta minutus a mitatagan.,you have thirty minutes left.
magaral ka bukas.,you'll go to school tomorrow.
"salamat. ""alang nanu naman.""","thank you. ""you're welcome."""
e balang kikislap gintu.,all that glitters is not gold.
buri mung gawan ine o ali?,do you want to do this or not?
balang lima yang aldong daratang keni.,he comes here every five days.
makananu neng alutas tom ing prublema?,how did tom solve the problem?
pilan ya bulan ing mars?,how many moons does mars have?
pasalamat ku kareng anak ku.,i am thankful for my children.
pasalamat ku kareng ana'ku.,i am thankful for my children.
sinali kung libru tungkul kareng animal.,i bought a book about animals.
eku pa miras karin.,i had never been there before.
atin kung planu kayabe ya i tom potang bengi.,i have plans with tom tonight.
taganang eku balu ing sabian ku.,i just don't know what to say.
kaylangan kung saling lasun dagis.,i need to buy some rat poison.
king palage ku akalingwan neng tom ing kayang camera.,i think tom forgot his camera.
bala ku taga boston ya i tom.,i thought tom was from boston.
bala ku tau ya boston i tom.,i thought tom was from boston.
buri rakang kutnan tungkul kang tom.,i'd like to ask you about tom.
"matwa ku, oneng ekupa makanyan katwa.","i'm old, but i'm not that old."
ita ing busal ning pisasabian.,that's the crux of the matter.
tinikdo ya ing matwang lalaki king babo talimunduk.,the old man stood on the hill.
tinikdo ya ing matwang lalaki king babo bunduk-bundukan.,the old man stood on the hill.
ena ikwang tom ing buri na.,tom didn't get what he wanted.
e minta king ospital i tom.,tom didn't go to the hospital.
e lupang doktor i tom.,tom didn't look like a doctor.
e migpalto anyang apunan i tom.,tom didn't show up for dinner.
balamu e nakatamu daramdaman tom.,tom doesn't appear to hear us.
e mapamangan karni i tom.,tom doesn't eat a lot of meat.
ene man balung tom ing lagyu ku.,tom doesn't even know my name.
ala yang tau i tom.,tom doesn't have a girlfriend.
e kaylangang manayang malambat i tom.,tom doesn't have long to wait.
ena balung tom a atyu i mary.,tom doesn't know mary is here.
ena balung tom nung nanu ita.,tom doesn't know what that is.
enaku masyadung buring tom.,tom doesn't like me very much.
balamu e bitasang mapagal i tom.,tom doesn't seem tired at all.
migmaneu ya i tom king metung a dalan king disyertu.,tom drove along a desert road.
ayari nong inos tom deng pinggan.,tom finished doing the dishes.
atin yang tatalnan i tom.,tom had something in his hand.
atin yang asawa ampong atlung anak i tom.,tom has a wife and three kids.
dayu ya ing asawa nang tom.,tom is married to a foreigner.
balu nang tom a magigisan na ing panaun.,tom knows time is running out.
pota e miratang king ustung oras i tom.,tom might not make it in time.
meki-kaluguran tana kang tom.,we have made friends with tom.
meki-kaluguran nakami kang tom.,we have made friends with tom.
pepabalu mi ing kayang pangawala.,we reported his disappearance.
belita mi ing kayang pangawala.,we reported his disappearance.
simbung mi ing kayang pangawala.,we reported his disappearance.
nanung gewa yu king metung at metung?,what did you do to each other?
mipagnanu kayu?,what did you do to each other?
king palage mu nananu ku?,what do you think i was doing?
keraklan nanu kang oras maugtu?,when do you usually eat lunch?
nukarin yang grupu ing kaluguran mu?,which group is your friend in?
ot ala yang gagawan i tom?,why isn't tom doing something?
gawan mung pasibayu ita?,are you going to do that again?
gawan mung pasibayu yan?,are you going to do that again?
atin lang pamalak deng sabla.,everyone has their own opinion.
makananu kung miras king sumangid?,how do i get to the other side?
makananu mung sabyan ita king italianu?,how do you say that in italian?
eke buri ing binye na kakung tom.,i didn't like what tom gave me.
ekuna sa sinabi kang tom ita.,i wish i'd never told tom that.
sana ekuna sinabi kang tom ita.,i wish i'd never told tom that.
sayang ing panaun ampo ing pera.,it's a waste of time and money.
balu na sigurung maryng buri ke.,mary probably knows i like her.
ala yang kasing-ulaga ing lugud.,nothing is as precious as love.
simbut no ngan deng premyu.,she carried off all the prizes.
simbut no ngan deng galal.,she carried off all the prizes.
dakal ya imalan.,she has quite a lot of clothes.
mabilis yang menik king eran.,she quickly went up the stairs.
mibalik ya kilub ning metung a oras.,she will return within an hour.
pakit mu kaku ing agyu mung daptan.,show me what you're capable of.
ala ya ang inamin.,so far he has admitted nothing.
mesira ya ing lakanbalen uling king silab.,the city was destroyed by fire.
mesira ya ing syudad uling king silab.,the city was destroyed by fire.
atin yang bageng gawa king balat ing tindahan.,the shop carried leather goods.
ini ing malyari.,this is what's going to happen.
ini ing marapat.,this is what's going to happen.
taganang matenakan ya i tom.,tom certainly is knowledgeable.
e maybug manigaral i tom.,tom doesn't feel like studying.
mesipit ya i tom king trapik.,tom got stuck in a traffic jam.
mas matas yang bagya kesa kaku i tom.,tom is a little taller than me.
magmaneu ya papunta king ospital i tom.,tom is driving to the hospital.
megobra ya i tom anggang malalam ing bengi.,tom worked until late at night.
nanung milyari kareng pengari nang tom?,what happened to tom's parents?
"karatang na, menyangkap kung kape.","when he arrived, i made coffee."
ot linwal ka king twitter?,why did you quit using twitter?
ika ing pekamatas a tau keni.,you're the tallest person here.
panintunan ning bingut ing gatas ning ima na.,a baby craves its mother's milk.
abalitan mu na ing tungkul kang tom ampo kang mary?,did you hear about tom and mary?
eme ikit i tom king party?,didn't you see tom at the party?
eme ikit i tom king sulu-sulu?,didn't you see tom at the party?
emu pabureng isinup ne ining letratu.,don't let him keep this picture.
emo buring akit deng anak mo?,don't you want to see your kids?
atin lang pamalak deng sabla.,everybody has their own opinion.
kokomustan na ing kekang pamikakatan.,he was asking about your health.
kokomustan na ing kekang kabulasan.,he was asking about your health.
eku balu nung atin kung oras.,i don't know if i have the time.
tabalu nung atin kung oras.,i don't know if i have the time.
bisa kung saling metung a dusenang donat.,i want to buy a dozen doughnuts.
eku pabureng ating malyaring marok.,i won't let anything bad happen.
puntalan daka kilub ning apulung minutu.,i'll be with you in ten minutes.
sinayad ku. matudtud naku.,i'm exhausted. i'm going to bed.
"panupaya yu, mitawli ku. eku gad migising.",i'm sorry i'm late. i overslept.
siguradu kung pansamantala mu ini.,i'm sure this is only temporary.
e marapat kang tom ita.,it's not going to happen to tom.
e malyari kang tom ita.,it's not going to happen to tom.
migkulung ya king kwartu na.,she shut herself up in her room.
keraklan keni lang kwartu matudud.,they usually sleep in this room.
kaylangan yang larinan ining trak.,this truck is in need of repair.
ena apigil tom ing kayang mwa.,tom couldn't suppress his anger.
enaku penyaling tom king kaylangan ku.,tom didn't buy me what i needed.
nanu lang klasing kwat?,what kind of mushrooms are they?
ot emu ne mu pabureng sumaup i tom?,why don't you just let tom help?
"atatandanan ye ngan i tom, e wari?","you all remember tom, don't you?"
ala kang bitasang balu kaku.,you don't know a thing about me.
mabunduk yang bangsa ing armenia.,armenia is a mountainous country.
mas matwa yang atlung banwa kesa kaku.,he's three years older than i am.
eku mekatudtud masalese nabengi.,i couldn't sleep well last night.
atin kung bayung paris a medyas.,i have a brand new pair of socks.
balaku salwan neng tom ing kotsing yan.,i thought tom would buy that car.
buri ku patdan me ing radyu.,i want you to turn off the radio.
bisa kung saling aspirin.,i would like to buy some aspirin.
param ku keka ing perang buri mu.,i'll loan you the money you want.
paraman daka ketang perang buri mu.,i'll loan you the money you want.
bala nang mary malsinta ku kaya.,mary thinks i'm in love with her.
panamdaman nong gagalgal deng tud na.,she could feel her knees shaking.
tatakut yang lumipat king dalan.,she was scared to cross the road.
mas masanting ing atin kesa king ala.,something is better than nothing.
lima lang pulu deng kayanib king aguman.,there are 50 members in the club.
alus e mangutang tungkul kanita i tom.,tom almost never asks about that.
ene pa ikit tom makanyan kasaya i mary.,tom had never seen mary so happy.
linundag ya i tom palwal king helicopter.,tom jumped out of the helicopter.
pepabye ne kakung tom kang mary ini.,tom told me to give this to mary.
penaya neng mibalik tom i mary.,tom waited for mary to come back.
menaya ya king arap ning bale i tom.,tom waited in front of the house.
minta ya king suluk i tom at kinyak ya.,tom went into a corner and cried.
ot inaus muku keni?,what did you call me in here for?
mas masanting ka katawan kesa kaku.,you're in better shape than i am.
alus ikami ngan byasang magsalitang pranses.,almost all of us can speak french.
atyu la king kekayu deng pengari mo?,are your parents going to be home?
king palage mu ligtas gawan ita?,do you think it's safe to do that?
e ya mekigalame kaku.,he refused to shake hands with me.
makananu ka nung ala kang obra?,how will you manage without a job?
eku balung makatuknang ya king boston i tom.,i didn't know tom lived in boston.
ala kung kabalu-balu tungkul kaniti.,i didn't know anything about this.
king palage ku gewa nang tom ing agyu na.,i think tom did the best he could.
payntunan ku ing pangamestru.,i'm going to miss being a teacher.
payntunan ku ing pangamestra.,i'm going to miss being a teacher.
payntunan ku ing pangatalaturu.,i'm going to miss being a teacher.
inaus naku ning bos ku king kayang upisina.,my boss called me into his office.
apakan no kaya deng gule na.,she got him to eat his vegetables.
buri neng pakaban ning syudad ing dalan.,the city wants to extend the road.
buri neng pakaban ning lakanbalen ing dalan.,the city wants to extend the road.
buri neng pakaban ning ciudad ing dalan.,the city wants to extend the road.
keni ya pekamalapad ing ilug.,the river is widest at this point.
pota makasara ne ing tindahan.,the store might be closed already.
ala kung akarapat kanita.,there's nothing i can do about it.
metung la pang aldong miyabe-abe.,they stayed one more day together.
matibe ya pundasyun ing baleng ini.,this house has a solid foundation.
binwat neng tom i maria kareng pago na.,tom carried mary on his shoulders.
atin yang buring sabian i tom.,tom has something he wants to say.
kinera neng tom ing raketa king gabun.,tom laid the racket on the ground.
manuknangan ya king marangle king california.,tom lives on a farm in california.
dapat pepasaup ya i tom kang mary.,tom should've asked mary for help.
dela nang tom ing eganagana king upisina na.,tom took everything to his office.
dela nang tom ing sabla king upisina na.,tom took everything to his office.
alas singku keng miras king istasyun.,we arrived at the station at five.
"neng miminum ya i tom, deng eganagana miminum la.","when tom drinks, everybody drinks."
bisa kang inuman?,would you like something to drink?
bisa kang minom?,would you like something to drink?
atin kang buring inuman?,would you like something to drink?
siguradu kang makasadya ka kanine?,are you sure you're ready for this?
siguradu kang makasadya ka kanite?,are you sure you're ready for this?
pakilako mu ining basura keni.,can you get this trash out of here?
pakisalangyan mu ne mo ing radyo?,could you please turn the radio on?
atin kang problema kanita?,do you have any problems with that?
dininan danakang palayo?,have they given you a nickname yet?
makananu mung babalakang bayaran ita?,how do you plan on paying for that?
pilan la reng malapit mung kaluguran?,how many close friends do you have?
makapagsalita kung dakal a amanu ning africa.,i can speak many african languages.
king palage ku ene pa ikit tom i mary.,i don't think tom has met mary yet.
eraka dapat dela keni.,i never should've brought you here.
magaling ya kanung maglutu.,it is said that she is a good cook.
misan ya paruminggung manalbeng sine.,she goes to the movies once a week.
makakawa lang danum deng aliwang klasing pamangan.,some kinds of food make us thirsty.
sisiran dong ane deng bale.,termites are destroying the houses.
buri rang abalu nung nanung malilyari.,they want to know what's happening.
ene bisang kumabye i tom.,tom didn't want to live any longer.
kinangwa yang kwalta kang tata na i tom.,tom got some money from his father.
sinopan neng tom tumakas king sukulan i mary.,tom helped mary escape from prison.
magsadya yang magobra i tom.,tom is getting ready to go to work.
e bitasang punta kareng lugal a anti kanita i tom.,tom never goes to places like that.
minta ya king boston i tom atlu nang banwa ing milabas.,tom went to boston three years ago.
e makanyan kalagwang kumbinsyan i tom,tom won't be that easy to convince.
eta malyaring magkanwaring e milyari ita.,we can't pretend it never happened.
mika pamagsulit tamu king pranses keng lunis.,we'll have a french test on monday.
maki masabal kami king payntungulan nang tom.,we're concerned about tom's future.
migaganaka kami king payntungulan nang tom.,we're concerned about tom's future.
ot pipiling ka?,what are you shaking your head for?
ot eka bisang tuki kekami?,why don't you want to come with us?
sabian mu kekami ing eganagana.,you're going to tell us everything.
ika ing migdala kaku keni.,you're the one who brought me here.
apanintun meng kwartu ing kapatad kung babai?,could you find a room for my sister?
pepaula naka?,have you ever had your fortune told?
pepakit na kaku nung makananu yang gamitan ining kamera.,he showed me how to use this camera.
aliwa neng tau ketang kakilala ku.,he's not the same man he used to be.
mete ya ing asawa na king aksidenti.,his wife was killed in the accident.
king palage ku balu mu ing kaylangan tang gawan.,i think you know what we have to do.
patingapun kung atyu king pagkeran napun.,i was in bed all day long yesterday.
"nung taganang mabye ya i tom, nukarin ya?","if tom is really alive, where is he?"
yan mu ing sabian mu kako?,is that all you're going to tell me?
bukas taya pisabyan ing prublemang ita.,let's discuss that problem tomorrow.
pepagaral ne ning ingkung na.,she was educated by her grandfather.
siryosuan mong bagya deng bage.,take things a little more seriously.
atyu mu king arap ku ing pakibat.,the answer was right in front of me.
tuki-tuki lang sinulagpo deng jet.,the jets took off one after another.
linawe miya ing masanting a dayatmalat.,we looked down at the beautiful sea.
tinikul ya king dalan ing metung a matwang babai.,an old woman limped along the street.
eka migaganaka. e lumbat ini.,don't worry. it won't take very long.
eka migaganaka.ena marapat pasibayu ini.,don't worry. this won't happen again.
makatatlu karakal ing panakita'na kesa kaku.,he earns three times as much as i do.
eku agawa ini nune king saup mu.,i couldn't do this without your help.
eku bisang luntong ipokritu.,i didn't want to appear hypocritical.
buri ku tambing kang magumpisa.,i want you to get started right away.
"nung manintun kang obra, awsan muku.","if you're looking for a job, call me."
ing pamangaylangan ing indu pamaglalang.,necessity is the mother of invention.
sabyan ku kang tom a eka malyare?,should i tell tom you're unavailable?
sabian mung pasibayu kaku nung ninung sumaup kekatamu.,tell me again who will be helping us.
alang sampagang tutubu king mars.,there are no flowers growing on mars.
minta ya king bale ku i tom nabengi.,tom came over to my house last night.
ena balung tom ot ala yu keni i mary.,tom doesn't know why mary isn't here.
atyu la king lande deng marinat nang imalang tom.,tom's dirty clothes are on the floor.
keng makadwa kami mako.,we're leaving the day after tomorrow.
keng makadwa tamu mako.,we're leaving the day after tomorrow.
nanung sinabi nang tom ketang milyari?,what did tom say about what happened?
kaylangan isumbung mu ini king pulis.,you should report this to the police.
lupa yang taganang maulaga ing rilo mu.,your watch seems to be very valuable.
lupa yang asnang kamal ing rilo mu.,your watch seems to be very valuable.
atin kang aisip a taung mas bage?,can you think of anyone more suitable?
atin kang balwat king kekang kahun kasangkapan?,do you have a crowbar in your toolbox?
ating maki prublema kanite?,does anybody have a problem with this?
balamu ditak la pamung tau deng mekapamasa na king libru.,few people seem to have read the book.
pilan lang tau deng makasake king bapor?,how many people are on board the ship?
mapagal nakung mabibyeng anti kanini.,i'm tired of living this kind of life.
memulayi la reng anak papunta king clasi.,the children ran toward the classroom.
memulayi la reng anak papunta king classroom.,the children ran toward the classroom.
"ena taganang sasaryan tom ita, ale?","tom doesn't really mean that, does he?"
malyaring atyu karin i tom. eku balu.,tom may have been there. i don't know.
miglwal yang pera i tom king kahun lamesa.,tom took some money out of the drawer.
"king palage mu, nukarin ngan miraras ing pera?",where do you think all the money goes?
"king palage mu, nukarin ngan miraras ing cualta?",where do you think all the money goes?
"sanung buri mu, kape o tsa?","which would you prefer, coffee or tea?"
"ing balu ku, talasawa ya pa i tom.","as far as i know, tom is still married."
atin nakang ikit metung man karene?,have you ever seen one of these before?
ala kung kabalu-bala nung nung nukarin na selikut tom ing pera.,i have no idea where tom hid the money.
kaylangan kung muli bayu dalumdum.,i have to get home before it gets dark.
sinabi ku ngan kang tom ing aisip ku.,i told tom everything i could think of.
maulagang tuparan mu ing kekang sinabi.,it is very important to keep your word.
siguru masanting a ala yu keni i tom.,maybe it's a good thing tom isn't here.
salamat king pamanagkat kaku king party.,thank you for inviting me to the party.
inabayan de reng pengari na ing anak a lalaki.,the boy was accompanied by his parents.
masaya ya ing mabilug a bangsa king balita.,the entire nation was glad at the news.
deni deng sapatus ku at deta deng keka.,these are my shoes and those are yours.
i tom namu ampo yaku ing atyu pa keni.,tom and i are the only ones still here.
mipag-tennis keng tom kanita.,tom and i used to play tennis together.
tutuki yang mamadwas i tom kang tata na kanita.,tom used to go fishing with his father.
ena gawang tom ing pepagawa ku kaya.,tom wouldn't do what i asked him to do.
magtaka kami nung nukarin ka ibat.,we've been wondering where you've been.
mekeni. atin kung buring pakit keka.,come here. i want to show you something.
king palage mu byasa yang munta karin i tom?,do you think tom knows how to get there?
seli ke ining libru king boston anyang milabasan a bulan.,i bought this book in boston last month.
eku balung ibat ka naman boston.,"i didn't know you were from boston, too."
atlu kung banwang menuknangan king boston.,i lived in boston for about three years.
dinatang ya i tom at dininan neng sobri i mary.,tom came in and handed mary an envelope.
